target_id,source_id,source_url,link_publication_date,origin,title,publisher,journal,volume,page,year_of_publishing,citationMetadata
10.18739/A2Z02Z86P,10.1002/2016GL070457,https://doi.org/10.1002/2016GL070457,2021-02-04,"P. Bakker, A. Schmittner, J. T. M. Lenaerts, A. Abe-Ouchi, D. Bi, M. R. van den Broeke, W.-L. Chan, A. Hu, R. L. Beadling, S. J. Marsland, S. H. Mernild, O. A. Saenko, D. Swingedouw, A. Sullivan, J. Yin",Fate of the Atlantic Meridional Overturning Circulation: Strong decline under continued warming and Greenland melting,American Geophysical Union (AGU),Geophysical Research Letters,43,"12,252-12,260",2016,
10.18739/A2J64Q,10.1002/2013JC009425,https://doi.org/10.1002/2013JC009425,2021-02-04,"Torge Martin, Michael Steele, Jinlun Zhang",Seasonality and long-term trend of Arctic Ocean surface stress in a model,American Geophysical Union (AGU),Journal of Geophysical Research: Oceans,119,1723-1738,2014,
10.5065/D6JH3J7Z,10.5194/tc-11-1015-2017,https://doi.org/10.5194/tc-11-1015-2017,2021-02-04,"Xavier Fettweis, Jason E. Box, Cécile Agosta, Charles Amory, Christoph Kittel, Charlotte Lang, Dirk van As, Horst Machguth, Hubert Gallée",Reconstructions of the 1900–2015 Greenland ice sheet surface mass balance using the regional climate MAR model,Copernicus GmbH,The Cryosphere,11,1015-1033,2017,
10.18739/A2MV9S,10.5194/tc-11-1015-2017,https://doi.org/10.5194/tc-11-1015-2017,2021-02-04,"Xavier Fettweis, Jason E. Box, Cécile Agosta, Charles Amory, Christoph Kittel, Charlotte Lang, Dirk van As, Horst Machguth, Hubert Gallée",Reconstructions of the 1900–2015 Greenland ice sheet surface mass balance using the regional climate MAR model,Copernicus GmbH,The Cryosphere,11,1015-1033,2017,
10.5065/D6VH5M06,10.1007/s11027-005-9016-3,https://doi.org/10.1007/s11027-005-9016-3,2021-02-04,"C. C. Thompson, A. D. McGuire, J. S. Clein, F. S. Chapin, J. Beringer",Net Carbon Exchange Across the Arctic Tundra-Boreal Forest Transition in Alaska 1981–2000,Springer Science and Business Media LLC,Mitigation and Adaptation Strategies for Global Change,11,805-827,2006,
urn:uuid:bd090a42-f1f6-4dcf-95d5-5f47544acdec,10.5194/tc-13-3337-2019,https://doi.org/10.5194/tc-13-3337-2019,2021-02-04,"Michael A. Rawlins, Lei Cai, Svetlana L. Stuefer, Dmitry Nicolsky",Changing characteristics of runoff and freshwater export from watersheds draining northern Alaska,Copernicus GmbH,The Cryosphere,13,3337-3352,2019,
10.18739/A2NV99B3R,10.1890/14-1323.1,https://doi.org/10.1890/14-1323.1,2021-02-04,"A. R. Pearce, E. B. Rastetter, B. L. Kwiatkowski, W. B. Bowden, M. C. Mack, Y. Jiang",Recovery of arctic tundra from thermal erosion disturbance is constrained by nutrient accumulation: a modeling analysis,Wiley,Ecological Applications,25,1271-1289,2014,
10.5065/D69S1P60,10.1080/15230430.2001.12003416,https://doi.org/10.1080/15230430.2001.12003416,2021-02-04,"Anna E. Klene, Frederick E. Nelson, Nikolay I. Shiklomanov, Kenneth M. Hinkel","The N-factor in Natural Landscapes: Variability of Air and Soil-Surface Temperatures, Kuparuk River Basin, Alaska, U.S.A.",Informa UK Limited,"Arctic, Antarctic, and Alpine Research",33,140-148,2018,
10.5065/D68K776H,10.1029/2005GL022857,https://doi.org/10.1029/2005GL022857,2021-02-04,"L. R. Welp, J. T. Randerson, J. C. Finlay, S. P. Davydov, G. M. Zimova, A. I. Davydova, S. A. Zimov",A high-resolution time series of oxygen isotopes from the Kolyma River: Implications for the seasonal dynamics of discharge and basin-scale water use,American Geophysical Union (AGU),Geophysical Research Letters,32,n/a-n/a,2005,
10.18739/A2ZS2KD0Z,10.1029/2008JD010235,https://doi.org/10.1029/2008JD010235,2021-02-04,"J. Ryan Banta, Joseph R. McConnell, Markus M. Frey, Roger C. Bales, Kendrick Taylor",Spatial and temporal variability in snow accumulation at the West Antarctic Ice Sheet Divide over recent centuries,American Geophysical Union (AGU),Journal of Geophysical Research,113,NULL,2008,
10.18739/A2WP7S,10.1016/j.bios.2011.12.013,https://doi.org/10.1016/j.bios.2011.12.013,2021-02-04,"Elliot S. Friedman, Miriam A. Rosenbaum, Alexander W. Lee, David. A. Lipson, Bruce R. Land, Largus T. Angenent",A cost-effective and field-ready potentiostat that poises subsurface electrodes to monitor bacterial respiration,Elsevier BV,Biosensors and Bioelectronics,32,309-313,2011,
10.18739/A2GW6R,10.3189/172756411795931516,https://doi.org/10.3189/172756411795931516,2021-02-04,"Chris Polashenski, Don Perovich, Jackie Richter-Menge, Bruce Elder",Seasonal ice mass-balance buoys: adapting tools to the changing Arctic,Cambridge University Press (CUP),Annals of Glaciology,52,18-26,2011,
10.18739/A2G30J,10.3189/172756411795931516,https://doi.org/10.3189/172756411795931516,2021-02-04,"Chris Polashenski, Don Perovich, Jackie Richter-Menge, Bruce Elder",Seasonal ice mass-balance buoys: adapting tools to the changing Arctic,Cambridge University Press (CUP),Annals of Glaciology,52,18-26,2011,
10.18739/A2BS4Q,10.1175/2010EI315.1,https://doi.org/10.1175/2010EI315.1,2021-02-04,"Uma S. Bhatt, Donald A. Walker, Martha K. Raynolds, Josefino C. Comiso, Howard E. Epstein, Gensuo Jia, Rudiger Gens, Jorge E. Pinzon, Compton J. Tucker, Craig E. Tweedie, Patrick J. Webber",Circumpolar Arctic Tundra Vegetation Change Is Linked to Sea Ice Decline,American Meteorological Society,Earth Interactions,14,1-20,2010,
10.18739/A2TS42,10.1175/2010EI315.1,https://doi.org/10.1175/2010EI315.1,2021-02-04,"Uma S. Bhatt, Donald A. Walker, Martha K. Raynolds, Josefino C. Comiso, Howard E. Epstein, Gensuo Jia, Rudiger Gens, Jorge E. Pinzon, Compton J. Tucker, Craig E. Tweedie, Patrick J. Webber",Circumpolar Arctic Tundra Vegetation Change Is Linked to Sea Ice Decline,American Meteorological Society,Earth Interactions,14,1-20,2010,
10.5065/D6NP22KX,10.1017/jog.2020.29,https://doi.org/10.1017/jog.2020.29,2021-04-23,"Jason M. Amundson, Christian Kienholz, Alexander O. Hager, Rebecca H. Jackson, Roman J. Motyka, Jonathan D. Nash, David A. Sutherland","Formation, flow and break-up of ephemeral ice mélange at LeConte Glacier and Bay, Alaska",Cambridge University Press (CUP),Journal of Glaciology,66,577-590,2020,
10.18739/A22G44,10.1017/jog.2020.29,https://doi.org/10.1017/jog.2020.29,2021-04-23,"Jason M. Amundson, Christian Kienholz, Alexander O. Hager, Rebecca H. Jackson, Roman J. Motyka, Jonathan D. Nash, David A. Sutherland","Formation, flow and break-up of ephemeral ice mélange at LeConte Glacier and Bay, Alaska",Cambridge University Press (CUP),Journal of Glaciology,66,577-590,2020,
10.5065/D68S4N4H,10.1002/ppp.452,https://doi.org/10.1002/ppp.452,2021-02-04,"D. A. Walker, G. J. Jia, H. E. Epstein, M. K. Raynolds, F. S. Chapin III, C. Copass, L. D. Hinzman, J. A. Knudson, H. A. Maier, G. J. Michaelson, F. Nelson, C. L. Ping, V. E. Romanovsky, N. Shiklomanov","Vegetation-soil-thaw-depth relationships along a low-arctic bioclimate gradient, Alaska: synthesis of information from the ATLAS studies",Wiley,Permafrost and Periglacial Processes,14,103-123,2003,
10.18739/A26336,10.1029/2011GB004037,https://doi.org/10.1029/2011GB004037,2021-02-04,"Donatella Zona, David A. Lipson, Kyaw T. Paw U, Steve F. Oberbauer, Paulo Olivas, Beniamino Gioli, Walter C. Oechel",Increased CO2loss from vegetated drained lake tundra ecosystems due to flooding,American Geophysical Union (AGU),Global Biogeochemical Cycles,26,n/a-n/a,2012,
10.18739/A21C9P,10.1029/2011GB004037,https://doi.org/10.1029/2011GB004037,2021-02-04,"Donatella Zona, David A. Lipson, Kyaw T. Paw U, Steve F. Oberbauer, Paulo Olivas, Beniamino Gioli, Walter C. Oechel",Increased CO2loss from vegetated drained lake tundra ecosystems due to flooding,American Geophysical Union (AGU),Global Biogeochemical Cycles,26,n/a-n/a,2012,
10.18739/A2WS05,10.1007/s10533-013-9862-0,https://doi.org/10.1007/s10533-013-9862-0,2021-02-04,"Tamara K. Harms, Benjamin W. Abbott, Jeremy B. Jones",Thermo-erosion gullies increase nitrogen available for hydrologic export,Springer Science and Business Media LLC,Biogeochemistry,117,299-311,2013,
10.18739/A2D795B1R,10.1029/2017JF004597,https://doi.org/10.1029/2017JF004597,2021-02-04,"B. Vandecrux, R. S. Fausto, P. L. Langen, D. van As, M. MacFerrin, W. T. Colgan, T. Ingeman-Nielsen, K. Steffen, N. S. Jensen, M. T. Møller, J. E. Box",Drivers of Firn Density on the Greenland Ice Sheet Revealed by Weather Station Observations and Modeling,American Geophysical Union (AGU),Journal of Geophysical Research: Earth Surface,123,2563-2576,2018,
10.5065/D6NP22KX,10.1029/2017JF004597,https://doi.org/10.1029/2017JF004597,2021-02-04,"B. Vandecrux, R. S. Fausto, P. L. Langen, D. van As, M. MacFerrin, W. T. Colgan, T. Ingeman-Nielsen, K. Steffen, N. S. Jensen, M. T. Møller, J. E. Box",Drivers of Firn Density on the Greenland Ice Sheet Revealed by Weather Station Observations and Modeling,American Geophysical Union (AGU),Journal of Geophysical Research: Earth Surface,123,2563-2576,2018,
10.18739/A2222R601,10.1016/j.dsr2.2010.10.027,https://doi.org/10.1016/j.dsr2.2010.10.027,2021-02-04,"M.J. Lewis, J.L. Tison, B. Weissling, B. Delille, S.F. Ackley, F. Brabant, H. Xie",Sea ice and snow cover characteristics during the winter–spring transition in the Bellingshausen Sea: An overview of SIMBA 2007,Elsevier BV,Deep Sea Research Part II: Topical Studies in Oceanography,58,1019-1038,2010,
10.18739/A26D5PB2S,10.1016/j.dsr2.2010.10.027,https://doi.org/10.1016/j.dsr2.2010.10.027,2021-02-04,"M.J. Lewis, J.L. Tison, B. Weissling, B. Delille, S.F. Ackley, F. Brabant, H. Xie",Sea ice and snow cover characteristics during the winter–spring transition in the Bellingshausen Sea: An overview of SIMBA 2007,Elsevier BV,Deep Sea Research Part II: Topical Studies in Oceanography,58,1019-1038,2010,
10.18739/A26D5PB2S,10.5194/tc-5-631-2011,https://doi.org/10.5194/tc-5-631-2011,2021-02-04,"J.-C. Gallet, F. Domine, L. Arnaud, G. Picard, J. Savarino","Vertical profile of the specific surface area and density of the snow at Dome C and on a transect to Dumont D'Urville, Antarctica – albedo calculations and comparison to remote sensing products",Copernicus GmbH,The Cryosphere,5,631-649,2011,
10.18739/A26D5PB2S,10.3189/2012JoG11J201,https://doi.org/10.3189/2012JoG11J201,2021-02-04,"Shin Sugiyama, Hiroyuki Enomoto, Shuji Fujita, Kotaro Fukui, Fumio Nakazawa, Per Holmlund, Sylviane Surdyk",Snow density along the route traversed by the Japanese-Swedish Antarctic Expedition 2007/08,Cambridge University Press (CUP),Journal of Glaciology,58,529-539,2012,
10.18739/A26D5PB2S,10.3189/002214311797409820,https://doi.org/10.3189/002214311797409820,2021-02-04,"Ding Minghu, Xiao Cunde, Li Yuansheng, Ren Jiawen, Hou Shugui, Jin Bo, Sun Bo","Spatial variability of surface mass balance along a traverse route from Zhongshan station to Dome A, Antarctica",Cambridge University Press (CUP),Journal of Glaciology,57,658-666,2011,
10.18739/A26D5PB2S,10.1002/2017GL075707,https://doi.org/10.1002/2017GL075707,2021-02-04,"Olivia Miller, D. Kip Solomon, Clément Miège, Lora Koenig, Richard Forster, Nicholas Schmerr, Stefan R. M. Ligtenberg, Lynn Montgomery",Direct Evidence of Meltwater Flow Within a Firn Aquifer in Southeast Greenland,American Geophysical Union (AGU),Geophysical Research Letters,45,207-215,2017,
10.18739/A26D5PB2S,10.1002/2013GL058023,https://doi.org/10.1002/2013GL058023,2021-02-04,"Bryn Hubbard, Jean-Louis Tison, Morgane Philippe, Billie Heene, Frank Pattyn, Terry Malone, Johannes Freitag",Ice shelf density reconstructed from optical televiewer borehole logging,American Geophysical Union (AGU),Geophysical Research Letters,40,5882-5887,2013,
10.18739/A26D5PB2S,10.1002/2017JF004357,https://doi.org/10.1002/2017JF004357,2021-02-04,"E. M. Morris, R. Mulvaney, R. J. Arthern, D. Davies, R. J. Gurney, P. Lambert, J. De Rydt, A. M. Smith, R. J. Tuckwell, M. Winstrup","Snow Densification and Recent Accumulation Along the iSTAR Traverse, Pine Island Glacier, Antarctica",American Geophysical Union (AGU),Journal of Geophysical Research: Earth Surface,122,2284-2301,2017,
10.18739/A2ZS2KD0Z,10.1002/2017JF004357,https://doi.org/10.1002/2017JF004357,2021-02-04,"E. M. Morris, R. Mulvaney, R. J. Arthern, D. Davies, R. J. Gurney, P. Lambert, J. De Rydt, A. M. Smith, R. J. Tuckwell, M. Winstrup","Snow Densification and Recent Accumulation Along the iSTAR Traverse, Pine Island Glacier, Antarctica",American Geophysical Union (AGU),Journal of Geophysical Research: Earth Surface,122,2284-2301,2017,
10.18739/A26D5PB2S,10.1029/2003JD004300,https://doi.org/10.1029/2003JD004300,2021-02-04,Jack E. Dibb,"Snow accumulation, surface height change, and firn densification at Summit, Greenland: Insights from 2 years of in situ observation",American Geophysical Union (AGU),Journal of Geophysical Research,109,NULL,2005,
10.18739/A2ZS2KD0Z,10.1029/2003JD004300,https://doi.org/10.1029/2003JD004300,2021-02-04,Jack E. Dibb,"Snow accumulation, surface height change, and firn densification at Summit, Greenland: Insights from 2 years of in situ observation",American Geophysical Union (AGU),Journal of Geophysical Research,109,NULL,2005,
10.18739/A26D5PB2S,10.1029/2001JD900067,https://doi.org/10.1029/2001JD900067,2021-02-04,"E. Mosley-Thompson, J. R. McConnell, R. C. Bales, Z. Li, P.-N. Lin, K. Steffen, L. G. Thompson, R. Edwards, D. Bathke",Local to regional-scale variability of annual net accumulation on the Greenland ice sheet from PARCA cores,American Geophysical Union (AGU),Journal of Geophysical Research: Atmospheres,106,33839-33851,2004,
10.18739/A2ZS2KD0Z,10.1029/2001JD900067,https://doi.org/10.1029/2001JD900067,2021-02-04,"E. Mosley-Thompson, J. R. McConnell, R. C. Bales, Z. Li, P.-N. Lin, K. Steffen, L. G. Thompson, R. Edwards, D. Bathke",Local to regional-scale variability of annual net accumulation on the Greenland ice sheet from PARCA cores,American Geophysical Union (AGU),Journal of Geophysical Research: Atmospheres,106,33839-33851,2004,
10.18739/A26D5PB2S,10.1002/grl.50706,https://doi.org/10.1002/grl.50706,2021-02-04,"B. Medley, I. Joughin, S. B. Das, E. J. Steig, H. Conway, S. Gogineni, A. S. Criscitiello, J. R. McConnell, B. E. Smith, M. R. van den Broeke, J. T. M. Lenaerts, D. H. Bromwich, J. P. Nicolas","Airborne-radar and ice-core observations of annual snow accumulation over Thwaites Glacier, West Antarctica confirm the spatiotemporal variability of global and regional atmospheric models",American Geophysical Union (AGU),Geophysical Research Letters,40,3649-3654,2013,
10.18739/A2ZS2KD0Z,10.1002/grl.50706,https://doi.org/10.1002/grl.50706,2021-02-04,"B. Medley, I. Joughin, S. B. Das, E. J. Steig, H. Conway, S. Gogineni, A. S. Criscitiello, J. R. McConnell, B. E. Smith, M. R. van den Broeke, J. T. M. Lenaerts, D. H. Bromwich, J. P. Nicolas","Airborne-radar and ice-core observations of annual snow accumulation over Thwaites Glacier, West Antarctica confirm the spatiotemporal variability of global and regional atmospheric models",American Geophysical Union (AGU),Geophysical Research Letters,40,3649-3654,2013,
10.18739/A26D5PB2S,10.3189/2013AoG63A358,https://doi.org/10.3189/2013AoG63A358,2021-02-04,"Clément Miège, Richard R. Forster, Jason E. Box, Evan W. Burgess, Joseph R. McConnell, Daniel R. Pasteris, Vandy B. Spikes",Southeast Greenland high accumulation rates derived from firn cores and ground-penetrating radar,International Glaciological Society,Annals of Glaciology,54,322-332,2013,
10.18739/A2ZS2KD0Z,10.3189/2013AoG63A358,https://doi.org/10.3189/2013AoG63A358,2021-02-04,"Clément Miège, Richard R. Forster, Jason E. Box, Evan W. Burgess, Joseph R. McConnell, Daniel R. Pasteris, Vandy B. Spikes",Southeast Greenland high accumulation rates derived from firn cores and ground-penetrating radar,International Glaciological Society,Annals of Glaciology,54,322-332,2013,
10.18739/A26D5PB2S,10.1002/2013GL058083,https://doi.org/10.1002/2013GL058083,2021-02-04,"Lora S. Koenig, Clément Miège, Richard R. Forster, Ludovic Brucker",Initial in situ measurements of perennial meltwater storage in the Greenland firn aquifer,American Geophysical Union (AGU),Geophysical Research Letters,41,81-85,2013,
10.18739/A2B56D46X,10.1029/AR002p0157,https://doi.org/10.1029/AR002p0157,2021-02-04,Kenji Kojima,Densification of Snow in Antarctica,American Geophysical Union,Antarctic Snow and Ice Studies,NULL,157-218,2013,
10.18739/A2B56D46X,10.3189/S0022143000017111,https://doi.org/10.3189/S0022143000017111,2021-02-04,"P. J. Stephenson, H. Lister","Preliminary Results of the Glaciological Work on the Trans-Antarctic Expedition, 1955–58",Cambridge University Press (CUP),Journal of Glaciology,3,426-431,2017,
10.18739/A2B56D46X,10.1029/JZ067i007p02791,https://doi.org/10.1029/JZ067i007p02791,2021-02-04,"A. P. Crary, Edwin S. Robinson, Hugh F. Bennett, Walter W. Boyd",Glaciological regime of the Ross Ice Shelf,American Geophysical Union (AGU),Journal of Geophysical Research,67,2791-2807,2008,
10.18739/A2B56D46X,10.1029/2019WR026348,https://doi.org/10.1029/2019WR026348,2021-02-04,"Olivia Miller, D. Kip Solomon, Clément Miège, Lora Koenig, Richard Forster, Nicholas Schmerr, Stefan R. M. Ligtenberg, Anatoly Legchenko, Clifford I. Voss, Lynn Montgomery, Joseph R. McConnell",Hydrology of a Perennial Firn Aquifer in Southeast Greenland: An Overview Driven by Field Data,American Geophysical Union (AGU),Water Resources Research,56,NULL,2020,
10.18739/A2B56D46X,10.3189/S002214300000589X,https://doi.org/10.3189/S002214300000589X,2021-02-04,"J. R. Potter, J. G. Paren, J. Loynes",Glaciological and Oceanographic Calculations of the Mass Balance and Oxygen Isotope Ratio of a Melting Ice Shelf,International Glaciological Society,Journal of Glaciology,30,161-170,2017,
10.18739/A2B56D46X,10.3189/172756499781820987,https://doi.org/10.3189/172756499781820987,2021-02-04,"Wolfgang Graf, Oskar Reinwarth, Hans Oerter, Christoph Mayer, Astrid Lambrecht","Surface accumulation on Foundation Ice Stream, Antarctica",Cambridge University Press (CUP),Annals of Glaciology,29,23-28,2007,
10.18739/A2ZS2KD0Z,10.3189/172756499781820987,https://doi.org/10.3189/172756499781820987,2021-02-04,"Wolfgang Graf, Oskar Reinwarth, Hans Oerter, Christoph Mayer, Astrid Lambrecht","Surface accumulation on Foundation Ice Stream, Antarctica",Cambridge University Press (CUP),Annals of Glaciology,29,23-28,2007,
10.18739/A2B56D46X,10.3189/S0022143000011783,https://doi.org/10.3189/S0022143000011783,2021-02-04,"D. A. Peel, H. B. Clausen",Oxygen-Isotope and Total Beta-Radioactivity Measurements on 10 m Ice Cores from the Antarctic Peninsula,Cambridge University Press (CUP),Journal of Glaciology,28,43-55,2017,
10.18739/A2SJ19R56,10.1021/acs.est.5b01823,https://doi.org/10.1021/acs.est.5b01823,2021-02-04,"Colin P. Thackray, Carey L. Friedman, Yanxu Zhang, Noelle E. Selin",Quantitative Assessment of Parametric Uncertainty in Northern Hemisphere PAH Concentrations,American Chemical Society (ACS),Environmental Science & Technology,49,9185-9193,2015,
10.18739/A2ZS2KD0Z,10.3189/002214310793146296,https://doi.org/10.3189/002214310793146296,2021-02-04,"Francisco Fernandoy, Hanno Meyer, Hans Oerter, Frank Wilhelms, Wolfgang Graf, Jakob Schwander","Temporal and spatial variation of stable-isotope ratios and accumulation rates in the hinterland of Neumayer station, East Antarctica",Cambridge University Press (CUP),Journal of Glaciology,56,673-687,2010,
10.18739/A2ZS2KD0Z,10.1017/jog.2019.36,https://doi.org/10.1017/jog.2019.36,2021-02-04,"HANNES KONRAD, ANNA E. HOGG, ROBERT MULVANEY, ROBERT ARTHERN, REBECCA J. TUCKWELL, BROOKE MEDLEY, ANDREW SHEPHERD","Observations of surface mass balance on Pine Island Glacier, West Antarctica, and the effect of strain history in fast-flowing sections",Cambridge University Press (CUP),Journal of Glaciology,65,595-604,2019,
10.18739/A2ZS2KD0Z,10.3189/172756400781820705,https://doi.org/10.3189/172756400781820705,2021-02-04,"H. Oerter, F. Wilhelms, F. Jung-Rothenhäusler, F. Göktas, H. Miller, W. Graf, S. Sommer","Accumulation rates in Dronning Maud Land, Antarctica, as revealed by dielectric-profiling measurements of shallow firn cores",International Glaciological Society,Annals of Glaciology,30,27-34,2007,
10.18739/A2ZS2KD0Z,10.3189/S0260305500006273,https://doi.org/10.3189/S0260305500006273,2021-02-04,"W. Graf, H. Moser, H. Oerter, O. Reinwarth, W. Stichler","Accumulation and Ice-Core Studies on Filchner-Ronne Ice Shelf, Antarctica",International Glaciological Society,Annals of Glaciology,11,23-31,2017,
10.18739/A2ZS2KD0Z,10.1029/2011JD015916,https://doi.org/10.1029/2011JD015916,2021-02-04,"Dave G. Ferris, Jihong Cole-Dai, Angelica R. Reyes, Drew M. Budner",South Pole ice core record of explosive volcanic eruptions in the first and second millennia A.D. and evidence of a large eruption in the tropics around 535 A.D.,American Geophysical Union (AGU),Journal of Geophysical Research,116,NULL,2011,
10.18739/A2ZS2KD0Z,10.1002/jgrd.50362,https://doi.org/10.1002/jgrd.50362,2021-02-04,"Landon Burgener, Summer Rupper, Lora Koenig, Rick Forster, William F. Christensen, Jessica Williams, Michelle Koutnik, Clément Miège, Eric J. Steig, David Tingey, Durban Keeler, Laura Riley",An observed negative trend in West Antarctic accumulation rates from 1975 to 2010: Evidence from new observed and simulated records,American Geophysical Union (AGU),Journal of Geophysical Research: Atmospheres,118,4205-4216,2013,
10.18739/A2BD0D,10.1016/j.quascirev.2012.12.018,https://doi.org/10.1016/j.quascirev.2012.12.018,2021-02-04,"Leonid Polyak, Kelly M. Best, Kevin A. Crawford, Edward A. Council, Guillaume St-Onge",Quaternary history of sea ice in the western Arctic Ocean based on foraminifera,Elsevier BV,Quaternary Science Reviews,79,145-156,2013,
10.18739/A2KK94B8Q,10.1016/j.dsr2.2019.04.005,https://doi.org/10.1016/j.dsr2.2019.04.005,2021-02-04,"Caitlin A. Meadows, Jacqueline M. Grebmeier, Susan M. Kidwell",High-latitude benthic bivalve biomass and recent climate change: Testing the power of live-dead discordance in the Pacific Arctic,Elsevier BV,Deep Sea Research Part II: Topical Studies in Oceanography,162,152-163,2019,
10.5065/D63X84PT,10.1016/j.dsr2.2019.04.005,https://doi.org/10.1016/j.dsr2.2019.04.005,2021-02-04,"Caitlin A. Meadows, Jacqueline M. Grebmeier, Susan M. Kidwell",High-latitude benthic bivalve biomass and recent climate change: Testing the power of live-dead discordance in the Pacific Arctic,Elsevier BV,Deep Sea Research Part II: Topical Studies in Oceanography,162,152-163,2019,
10.5065/D6M043GJ,10.1016/j.dsr2.2019.04.005,https://doi.org/10.1016/j.dsr2.2019.04.005,2021-02-04,"Caitlin A. Meadows, Jacqueline M. Grebmeier, Susan M. Kidwell",High-latitude benthic bivalve biomass and recent climate change: Testing the power of live-dead discordance in the Pacific Arctic,Elsevier BV,Deep Sea Research Part II: Topical Studies in Oceanography,162,152-163,2019,
10.18739/A2N29P67H,10.1016/j.dsr2.2018.10.008,https://doi.org/10.1016/j.dsr2.2018.10.008,2021-02-04,"Hisatomo Waga, Toru Hirawake, Amane Fujiwara, Jacqueline M. Grebmeier, Sei-Ichi Saitoh",Impact of spatiotemporal variability in phytoplankton size structure on benthic macrofaunal distribution in the Pacific Arctic,Elsevier BV,Deep Sea Research Part II: Topical Studies in Oceanography,162,114-126,2018,
10.18739/A24746R53,10.1016/j.dsr2.2018.10.008,https://doi.org/10.1016/j.dsr2.2018.10.008,2021-02-04,"Hisatomo Waga, Toru Hirawake, Amane Fujiwara, Jacqueline M. Grebmeier, Sei-Ichi Saitoh",Impact of spatiotemporal variability in phytoplankton size structure on benthic macrofaunal distribution in the Pacific Arctic,Elsevier BV,Deep Sea Research Part II: Topical Studies in Oceanography,162,114-126,2018,
10.18739/A28W3827B,10.1016/j.dsr2.2019.01.002,https://doi.org/10.1016/j.dsr2.2019.01.002,2021-02-04,"Monika Kędra, Lee W. Cooper, Mengjie Zhang, Dana Biasatti, Jacqueline M. Grebmeier",Benthic trophic sensitivity to on-going changes in Pacific Arctic seasonal sea ice cover – Insights from the nitrogen isotopic composition of amino acids,Elsevier BV,Deep Sea Research Part II: Topical Studies in Oceanography,162,137-151,2019,
10.18739/A20000081,10.1016/j.dsr2.2019.01.002,https://doi.org/10.1016/j.dsr2.2019.01.002,2021-02-04,"Monika Kędra, Lee W. Cooper, Mengjie Zhang, Dana Biasatti, Jacqueline M. Grebmeier",Benthic trophic sensitivity to on-going changes in Pacific Arctic seasonal sea ice cover – Insights from the nitrogen isotopic composition of amino acids,Elsevier BV,Deep Sea Research Part II: Topical Studies in Oceanography,162,137-151,2019,
10.18739/A2HH6C58X,10.1016/j.dsr2.2019.01.002,https://doi.org/10.1016/j.dsr2.2019.01.002,2021-02-04,"Monika Kędra, Lee W. Cooper, Mengjie Zhang, Dana Biasatti, Jacqueline M. Grebmeier",Benthic trophic sensitivity to on-going changes in Pacific Arctic seasonal sea ice cover – Insights from the nitrogen isotopic composition of amino acids,Elsevier BV,Deep Sea Research Part II: Topical Studies in Oceanography,162,137-151,2019,
10.18739/A2ZW18S38,10.1016/j.dsr2.2019.01.002,https://doi.org/10.1016/j.dsr2.2019.01.002,2021-02-04,"Monika Kędra, Lee W. Cooper, Mengjie Zhang, Dana Biasatti, Jacqueline M. Grebmeier",Benthic trophic sensitivity to on-going changes in Pacific Arctic seasonal sea ice cover – Insights from the nitrogen isotopic composition of amino acids,Elsevier BV,Deep Sea Research Part II: Topical Studies in Oceanography,162,137-151,2019,
10.18739/A2736M23F,10.1016/j.dsr2.2018.10.007,https://doi.org/10.1016/j.dsr2.2018.10.007,2021-02-04,"Christina L. Goethel, Jacqueline M. Grebmeier, Lee W. Cooper","Changes in abundance and biomass of the bivalve Macoma calcarea in the northern Bering Sea and the southeastern Chukchi Sea from 1998 to 2014, tracked through dynamic factor analysis models",Elsevier BV,Deep Sea Research Part II: Topical Studies in Oceanography,162,127-136,2018,
