target_id,source_id,source_url,link_publication_date,origin,title,publisher,journal,volume,page,year_of_publishing,citationMetadata
10.18739/A2CN6Z04X,10.1029/2008GM000822,https://doi.org/10.1029/2008GM000822,2021-02-04,"Zicheng Yu, David W. Beilman, Miriam C. Jones",Sensitivity of Northern Peatland Carbon Dynamics to Holocene Climate Change,American Geophysical Union,Carbon Cycling in Northern Peatlands,NULL,55-69,2011,
10.18739/A27W67605,10.1029/2008GM000822,https://doi.org/10.1029/2008GM000822,2021-02-04,"Zicheng Yu, David W. Beilman, Miriam C. Jones",Sensitivity of Northern Peatland Carbon Dynamics to Holocene Climate Change,American Geophysical Union,Carbon Cycling in Northern Peatlands,NULL,55-69,2011,
10.18739/A20C4SK32,10.1029/2008GM000822,https://doi.org/10.1029/2008GM000822,2021-02-04,"Zicheng Yu, David W. Beilman, Miriam C. Jones",Sensitivity of Northern Peatland Carbon Dynamics to Holocene Climate Change,American Geophysical Union,Carbon Cycling in Northern Peatlands,NULL,55-69,2011,
10.18739/A2C24QM7X,10.1017/jog.2020.101,https://doi.org/10.1017/jog.2020.101,2021-02-01,"Jenna M. Zechmann, Martin Truffer, Roman J. Motyka, Jason M. Amundson, Chris F. Larsen","Sediment redistribution beneath the terminus of an advancing glacier, Taku Glacier (T'aakú Kwáan Sít'i), Alaska",Cambridge University Press (CUP),Journal of Glaciology,NULL,1-15,2020,
10.18739/A25W5K,10.1029/2020GL089894,https://doi.org/10.1029/2020GL089894,2021-02-01,"K. P. Wickland, M. T. Jorgenson, J. C. Koch, M. Kanevskiy, R. G. Striegl",Carbon Dioxide and Methane Flux in a Dynamic Arctic Tundra Landscape: Decadal‐Scale Impacts of Ice Wedge Degradation and Stabilization,American Geophysical Union (AGU),Geophysical Research Letters,47,NULL,2020,
10.18739/A29K97,10.1029/2020GL089894,https://doi.org/10.1029/2020GL089894,2021-02-01,"K. P. Wickland, M. T. Jorgenson, J. C. Koch, M. Kanevskiy, R. G. Striegl",Carbon Dioxide and Methane Flux in a Dynamic Arctic Tundra Landscape: Decadal‐Scale Impacts of Ice Wedge Degradation and Stabilization,American Geophysical Union (AGU),Geophysical Research Letters,47,NULL,2020,
urn:uuid:c5d13183-0e4f-4008-9492-b53b2cd40a26,10.1002/lno.11296,https://doi.org/10.1002/lno.11296,2021-06-30,"Alicia Cortés, Sally MacIntyre",Mixing processes in small arctic lakes during spring,Wiley,Limnology and Oceanography,65,260-288,2019,
urn:uuid:799b7a86-cb1c-497c-a05a-d73492915cad,10.1002/lno.11296,https://doi.org/10.1002/lno.11296,2021-06-30,"Alicia Cortés, Sally MacIntyre",Mixing processes in small arctic lakes during spring,Wiley,Limnology and Oceanography,65,260-288,2019,
urn:uuid:c5d13183-0e4f-4008-9492-b53b2cd40a26,10.1002/lno.11296,https://doi.org/10.1002/lno.11296,2021-06-30,"Alicia Cortés, Sally MacIntyre",Mixing processes in small arctic lakes during spring,Wiley,Limnology and Oceanography,65,260-288,2019,
urn:uuid:799b7a86-cb1c-497c-a05a-d73492915cad,10.1002/lno.11296,https://doi.org/10.1002/lno.11296,2021-06-30,"Alicia Cortés, Sally MacIntyre",Mixing processes in small arctic lakes during spring,Wiley,Limnology and Oceanography,65,260-288,2019,
10.18739/A21Z41S5S,10.5194/bg-2019-437,https://doi.org/10.5194/bg-2019-437,2021-02-04,"Dean Howard, Yannick Agnan, Detlev Helmig, Yu Yang, Daniel Obrist",Environmental controls on ecosystem-scale cold season methane and carbon dioxide fluxes in an Arctic tundra ecosystem,Copernicus GmbH,NULL,NULL,NULL,2019,
10.18739/A29P2W61J,10.1002/hyp.13611,https://doi.org/10.1002/hyp.13611,2021-02-04,"Tyler V. King, Bethany T. Neilson, Levi D. Overbeck, Douglas L. Kane",A distributed analysis of lateral inflows in an Alaskan Arctic watershed underlain by continuous permafrost,Wiley,Hydrological Processes,34,633-648,2019,
10.18739/A2K649S9D,10.1002/hyp.13611,https://doi.org/10.1002/hyp.13611,2021-02-04,"Tyler V. King, Bethany T. Neilson, Levi D. Overbeck, Douglas L. Kane",A distributed analysis of lateral inflows in an Alaskan Arctic watershed underlain by continuous permafrost,Wiley,Hydrological Processes,34,633-648,2019,
10.18739/A25M62692,10.1002/lno.11015,https://doi.org/10.1002/lno.11015,2021-06-30,"Travis W. Drake, Robert M. Holmes, Alexander V. Zhulidov, Tatiana Gurtovaya, Peter A. Raymond, James W. McClelland, Robert G. M. Spencer",Multidecadal climate‐induced changes in Arctic tundra lake geochemistry and geomorphology,Wiley,Limnology and Oceanography,64,NULL,2018,
10.18739/A25M62692,10.1002/lno.11015,https://doi.org/10.1002/lno.11015,2021-06-30,"Travis W. Drake, Robert M. Holmes, Alexander V. Zhulidov, Tatiana Gurtovaya, Peter A. Raymond, James W. McClelland, Robert G. M. Spencer",Multidecadal climate‐induced changes in Arctic tundra lake geochemistry and geomorphology,Wiley,Limnology and Oceanography,64,NULL,2018,
10.18739/A2DF6K36X,10.5194/bg-16-4051-2019,https://doi.org/10.5194/bg-16-4051-2019,2021-06-30,"Martin Jiskra, Jeroen E. Sonke, Yannick Agnan, Detlev Helmig, Daniel Obrist",Insights from mercury stable isotopes on terrestrial–atmosphere exchange of Hg(0) in the Arctic tundra,Copernicus GmbH,Biogeosciences,16,4051-4064,2019,
10.18739/A2DF6K36X,10.5194/bg-16-4051-2019,https://doi.org/10.5194/bg-16-4051-2019,2021-06-30,"Martin Jiskra, Jeroen E. Sonke, Yannick Agnan, Detlev Helmig, Daniel Obrist",Insights from mercury stable isotopes on terrestrial–atmosphere exchange of Hg(0) in the Arctic tundra,Copernicus GmbH,Biogeosciences,16,4051-4064,2019,
10.18739/A2T14TQ0T,10.1007/s00442-018-4196-1,https://doi.org/10.1007/s00442-018-4196-1,2021-06-30,"R. Gus Jespersen, A. Joshua Leffler, Steven F. Oberbauer, Jeffrey M. Welker",Arctic plant ecophysiology and water source utilization in response to altered snow: isotopic (δ18O and δ2H) evidence for meltwater subsidies to deciduous shrubs,Springer Science and Business Media LLC,Oecologia,187,1009-1023,2018,
10.18739/A2XS5JH54,10.1007/s00442-018-4196-1,https://doi.org/10.1007/s00442-018-4196-1,2021-06-30,"R. Gus Jespersen, A. Joshua Leffler, Steven F. Oberbauer, Jeffrey M. Welker",Arctic plant ecophysiology and water source utilization in response to altered snow: isotopic (δ18O and δ2H) evidence for meltwater subsidies to deciduous shrubs,Springer Science and Business Media LLC,Oecologia,187,1009-1023,2018,
10.18739/A2P843W5Z,10.1007/s00442-018-4196-1,https://doi.org/10.1007/s00442-018-4196-1,2021-06-30,"R. Gus Jespersen, A. Joshua Leffler, Steven F. Oberbauer, Jeffrey M. Welker",Arctic plant ecophysiology and water source utilization in response to altered snow: isotopic (δ18O and δ2H) evidence for meltwater subsidies to deciduous shrubs,Springer Science and Business Media LLC,Oecologia,187,1009-1023,2018,
10.18739/A2P843W5Z,10.1007/s00442-018-4196-1,https://doi.org/10.1007/s00442-018-4196-1,2021-06-30,"R. Gus Jespersen, A. Joshua Leffler, Steven F. Oberbauer, Jeffrey M. Welker",Arctic plant ecophysiology and water source utilization in response to altered snow: isotopic (δ18O and δ2H) evidence for meltwater subsidies to deciduous shrubs,Springer Science and Business Media LLC,Oecologia,187,1009-1023,2018,
10.18739/A2T14TQ0T,10.1007/s00442-018-4196-1,https://doi.org/10.1007/s00442-018-4196-1,2021-06-30,"R. Gus Jespersen, A. Joshua Leffler, Steven F. Oberbauer, Jeffrey M. Welker",Arctic plant ecophysiology and water source utilization in response to altered snow: isotopic (δ18O and δ2H) evidence for meltwater subsidies to deciduous shrubs,Springer Science and Business Media LLC,Oecologia,187,1009-1023,2018,
10.18739/A2XS5JH54,10.1007/s00442-018-4196-1,https://doi.org/10.1007/s00442-018-4196-1,2021-06-30,"R. Gus Jespersen, A. Joshua Leffler, Steven F. Oberbauer, Jeffrey M. Welker",Arctic plant ecophysiology and water source utilization in response to altered snow: isotopic (δ18O and δ2H) evidence for meltwater subsidies to deciduous shrubs,Springer Science and Business Media LLC,Oecologia,187,1009-1023,2018,
urn:uuid:7c3c5c36-5227-4e90-a7de-5033feb38706,10.1016/j.foreco.2018.03.008,https://doi.org/10.1016/j.foreco.2018.03.008,2021-02-04,"Heather D. Alexander, Susan M. Natali, Michael M. Loranty, Sarah M. Ludwig, Valentin V. Spektor, Sergey Davydov, Nikita Zimov, Ivonne Trujillo, Michelle C. Mack",Impacts of increased soil burn severity on larch forest regeneration on permafrost soils of far northeastern Siberia,Elsevier BV,Forest Ecology and Management,417,144-153,2018,
10.18739/A2PD3N,10.1130/G32856.1,https://doi.org/10.1130/G32856.1,2021-02-04,"B. A. Schubert, A. H. Jahren, J. J. Eberle, L. S. L. Sternberg, D. A. Eberth",A summertime rainy season in the Arctic forests of the Eocene,Geological Society of America,Geology,40,523-526,2012,
urn:uuid:c33f3d35-8120-4eb1-abaf-873b21314a50,10.1029/2011JD016186,https://doi.org/10.1029/2011JD016186,2021-02-04,"Laura S. Sherman, Joel D. Blum, Thomas A. Douglas, Alexandra Steffen","Frost flowers growing in the Arctic ocean-atmosphere-sea ice-snow interface: 2. Mercury exchange between the atmosphere, snow, and frost flowers",American Geophysical Union (AGU),Journal of Geophysical Research: Atmospheres,117,n/a-n/a,2011,
urn:uuid:c33f3d35-8120-4eb1-abaf-873b21314a50,10.1016/j.chemgeo.2014.05.012,https://doi.org/10.1016/j.chemgeo.2014.05.012,2021-02-04,"Amanda J. Barker, T.A. Douglas, A.D. Jacobson, J.W. McClelland, A.G. Ilgen, M.S. Khosh, G.O. Lehn, T.P. Trainor",Late season mobilization of trace metals in two small Alaskan arctic watersheds as a proxy for landscape scale permafrost active layer dynamics,Elsevier BV,Chemical Geology,381,180-193,2014,
urn:uuid:c33f3d35-8120-4eb1-abaf-873b21314a50,10.3189/2013JoG12J110,https://doi.org/10.3189/2013JoG12J110,2021-02-04,"Matthew Sturm, Svetlana Stuefer",Wind-blown flux rates derived from drifts at arctic snow fences,International Glaciological Society,Journal of Glaciology,59,21-34,2013,
10.18739/A2901ZG3N,10.1029/2003GL019003,https://doi.org/10.1029/2003GL019003,2021-02-04,"L. Padman, S. Erofeeva",A barotropic inverse tidal model for the Arctic Ocean,American Geophysical Union (AGU),Geophysical Research Letters,31,NULL,2004,
urn:uuid:b97a69fc-e002-4505-b089-b4f6d373f080,10.1029/98JD02517,https://doi.org/10.1029/98JD02517,2021-02-04,"James O. Pinto, Judith A. Curry, Amanda H. Lynch, P. O. G. Persson",Modeling clouds and radiation for the November 1997 period of SHEBA using a column climate model,American Geophysical Union (AGU),Journal of Geophysical Research: Atmospheres,104,6661-6678,2002,
10.18739/A2BK16Q2C,10.1175/WCAS-D-10-05006.1,https://doi.org/10.1175/WCAS-D-10-05006.1,2021-02-04,Susan A. Crate,A Political Ecology of “Water in Mind”: Attributing Perceptions in the Era of Global Climate Change,American Meteorological Society,"Weather, Climate, and Society",3,148-164,2011,
10.18739/A2BK16Q2C,10.1080/2154896X.2012.679560,https://doi.org/10.1080/2154896X.2012.679560,2021-02-04,Susan A. Crate,Climate change and ice dependent communities: perspectives from Siberia and Labrador,Informa UK Limited,The Polar Journal,2,61-75,2012,
urn:uuid:7a191645-f34c-49a8-b05a-b1755a7c64b7,10.1016/j.dsr2.2013.03.015,https://doi.org/10.1016/j.dsr2.2013.03.015,2021-02-04,"Henry P. Huntington, Ivonne Ortiz, George Noongwook, Maryann Fidel, Dorothy Childers, Muriel Morse, Julia Beaty, Lilian Alessa, Andrew Kliskey","Mapping human interaction with the Bering Sea ecosystem: Comparing seasonal use areas, lifetime use areas, and “calorie-sheds”",Elsevier BV,Deep Sea Research Part II: Topical Studies in Oceanography,94,292-300,2013,
10.18739/A2XK84Q7W,10.1130/G37693.1,https://doi.org/10.1130/G37693.1,2021-02-04,"Melissa L. Chipman, George W. Kling, Craig C. Lundstrom, Feng Sheng Hu",Multiple thermo-erosional episodes during the past six millennia: Implications for the response of Arctic permafrost to climate change,Geological Society of America,Geology,44,439-442,2016,
10.5065/D6K64G68,10.1016/S0304-4203(99)00109-7,https://doi.org/10.1016/S0304-4203(99)00109-7,2021-02-04,"Lee W Cooper, J.M Kelley, L.A Bond, K.A Orlandini, J.M Grebmeier",Sources of the transuranic elements plutonium and neptunium in arctic marine sediments,Elsevier BV,Marine Chemistry,69,253-276,2002,
10.18739/A25C5D,10.1002/2017GL074954,https://doi.org/10.1002/2017GL074954,2021-02-04,"M. Morlighem, C. N. Williams, E. Rignot, L. An, J. E. Arndt, J. L. Bamber, G. Catania, N. Chauché, J. A. Dowdeswell, B. Dorschel, I. Fenty, K. Hogan, I. Howat, A. Hubbard, M. Jakobsson, T. M. Jordan, K. K. Kjeldsen, R. Millan, L. Mayer, J. Mouginot, B. P. Y. Noël, C. O'Cofaigh, S. Palmer, S. Rysgaard, H. Seroussi, M. J. Siegert, P. Slabon, F. Straneo, M. R. van den Broeke, W. Weinrebe, M. Wood, K. B. Zinglersen",BedMachine v3: Complete Bed Topography and Ocean Bathymetry Mapping of Greenland From Multibeam Echo Sounding Combined With Mass Conservation,American Geophysical Union (AGU),Geophysical Research Letters,44,NULL,2017,
10.18739/A2FJ29D31,10.1175/BAMS-D-14-00145.1,https://doi.org/10.1175/BAMS-D-14-00145.1,2021-02-04,"Taneil Uttal, Sandra Starkweather, James R. Drummond, Timo Vihma, Alexander P. Makshtas, Lisa S. Darby, John F. Burkhart, Christopher J. Cox, Lauren N. Schmeisser, Thomas Haiden, Marion Maturilli, Matthew D. Shupe, Gijs De Boer, Auromeet Saha, Andrey A. Grachev, Sara M. Crepinsek, Lori Bruhwiler, Barry Goodison, Bruce McArthur, Von P. Walden, Edward J. Dlugokencky, P. Ola G. Persson, Glen Lesins, Tuomas Laurila, John A. Ogren, Robert Stone, Charles N. Long, Sangeeta Sharma, Andreas Massling, David D. Turner, Diane M. Stanitski, Eija Asmi, Mika Aurela, Henrik Skov, Konstantinos Eleftheriadis, Aki Virkkula, Andrew Platt, Eirik J. Førland, Yoshihiro Iijima, Ingeborg E. Nielsen, Michael H. Bergin, Lauren Candlish, Nikita S. Zimov, Sergey A. Zimov, Norman T. O’Neill, Pierre F. Fogal, Rigel Kivi, Elena A. Konopleva-Akish, Johannes Verlinde, Vasily Y. Kustov, Brian Vasel, Viktor M. Ivakhov, Yrjö Viisanen, Janet M. Intrieri",International Arctic Systems for Observing the Atmosphere: An International Polar Year Legacy Consortium,American Meteorological Society,Bulletin of the American Meteorological Society,97,1033-1056,2015,
urn:uuid:621d3674-aca3-4b39-bbe4-338fa125c826,10.1029/2010JG001634,https://doi.org/10.1029/2010JG001634,2021-02-04,"Claire G. Griffin, Karen E. Frey, John Rogan, Robert M. Holmes","Spatial and interannual variability of dissolved organic matter in the Kolyma River, East Siberia, observed using satellite imagery",American Geophysical Union (AGU),Journal of Geophysical Research,116,NULL,2011,
10.18739/A20306,10.3189/2012JoG12J078,https://doi.org/10.3189/2012JoG12J078,2021-02-04,"Peter D. Neff, Eric J. Steig, Douglas H. Clark, Joseph R. McConnell, Erin C. Pettit, Brian Menounos","Ice-core net snow accumulation and seasonal snow chemistry at a temperate-glacier site: Mount Waddington, southwest British Columbia, Canada",Cambridge University Press (CUP),Journal of Glaciology,58,1165-1175,2012,
10.18739/A2SQ0J,10.1130/G34760.1,https://doi.org/10.1130/G34760.1,2021-02-04,"Peter L. Moore, J. Paul Winberry, Neal R. Iverson, Knut A. Christianson, Sridhar Anandakrishnan, Miriam Jackson, Mark E. Mathison, Denis Cohen",Glacier slip and seismicity induced by surface melt,Geological Society of America,Geology,41,1247-1250,2013,
10.18739/A2MK6585Z,10.1130/G38114.1,https://doi.org/10.1130/G38114.1,2021-02-04,"Avriel D. Schweinsberg, Jason P. Briner, Gifford H. Miller, Ole Bennike, Elizabeth K. Thomas",Local glaciation in West Greenland linked to North Atlantic Ocean circulation during the Holocene,Geological Society of America,Geology,45,195-198,2017,
10.18739/A21W73,10.1007/s10933-008-9259-6,https://doi.org/10.1007/s10933-008-9259-6,2021-02-04,Darrell S. Kaufman,An overview of late Holocene climate and environmental change inferred from Arctic lake sediment,Springer Science and Business Media LLC,Journal of Paleolimnology,41,1-6,2008,
10.18739/A2X34MS1B,10.1029/2018JG004444,https://doi.org/10.1029/2018JG004444,2021-02-04,"M. A. Taylor, G. Celis, J. D. Ledman, R. Bracho, E. A. G. Schuur",Methane Efflux Measured by Eddy Covariance in Alaskan Upland Tundra Undergoing Permafrost Degradation,American Geophysical Union (AGU),Journal of Geophysical Research: Biogeosciences,123,2695-2710,2018,
10.18739/A2X34MS1B,10.1088/1748-9326/ab4d32,https://doi.org/10.1088/1748-9326/ab4d32,2021-02-04,"Kassandra Reuss-Schmidt, Peter Levy, Walter Oechel, Craig Tweedie, Cathy Wilson, Donatella Zona",Understanding spatial variability of methane fluxes in Arctic wetlands through footprint modelling,IOP Publishing,Environmental Research Letters,14,125010,2019,
10.18739/A2TH15,10.1029/2012JD018603,https://doi.org/10.1029/2012JD018603,2021-02-04,"Michael Sigl, Joseph R. McConnell, Lawrence Layman, Olivia Maselli, Ken McGwire, Daniel Pasteris, Dorthe Dahl-Jensen, Jørgen Peder Steffensen, Bo Vinther, Ross Edwards, Robert Mulvaney, Sepp Kipfstuhl",A new bipolar ice core record of volcanism from WAIS Divide and NEEM and implications for climate forcing of the last 2000 years,American Geophysical Union (AGU),Journal of Geophysical Research: Atmospheres,118,1151-1169,2012,
10.18739/A2JK2R,10.3189/2014JoG13J141,https://doi.org/10.3189/2014JoG13J141,2021-02-04,"Robert L. Hawley, Zoe R. Courville, Laura M. Kehrl, Eric R. Lutz, Erich C. Osterberg, Thomas B. Overly, Gifford J. Wong",Recent accumulation variability in northwest Greenland from ground-penetrating radar and shallow cores along the Greenland Inland Traverse,International Glaciological Society,Journal of Glaciology,60,375-382,2014,
10.18739/A26D5PB2S,10.3189/2014JoG13J141,https://doi.org/10.3189/2014JoG13J141,2021-02-04,"Robert L. Hawley, Zoe R. Courville, Laura M. Kehrl, Eric R. Lutz, Erich C. Osterberg, Thomas B. Overly, Gifford J. Wong",Recent accumulation variability in northwest Greenland from ground-penetrating radar and shallow cores along the Greenland Inland Traverse,International Glaciological Society,Journal of Glaciology,60,375-382,2014,
10.18739/A2VH5CJ35,10.1002/2016JC011994,https://doi.org/10.1002/2016JC011994,2021-02-04,"Chris Polashenski, Kenneth M. Golden, Donald K. Perovich, Eric Skyllingstad, Alexandra Arnsten, Carolyn Stwertka, Nicholas Wright",Percolation blockage: A process that enables melt pond formation on first year Arctic sea ice,American Geophysical Union (AGU),Journal of Geophysical Research: Oceans,122,413-440,2017,
10.5065/D6KP806T,10.1007/s00300-004-0675-4,https://doi.org/10.1007/s00300-004-0675-4,2021-02-04,"B. A. Bluhm, I. R. MacDonald, C. Debenham, K. Iken",Macro- and megabenthic communities in the high Arctic Canada Basin: initial findings,Springer Science and Business Media LLC,Polar Biology,28,218-231,2004,
10.18739/A2862BB03,10.1038/ngeo2147,https://doi.org/10.1038/ngeo2147,2021-02-04,"Julia L. Rosen, Edward J. Brook, Jeffrey P. Severinghaus, Thomas Blunier, Logan E. Mitchell, James E. Lee, Jon S. Edwards, Vasileios Gkinis",An ice core record of near-synchronous global climate changes at the Bølling transition,Springer Science and Business Media LLC,Nature Geoscience,7,459-463,2014,
10.18739/A2N29P63K,10.1175/JPO-D-18-0028.1,https://doi.org/10.1175/JPO-D-18-0028.1,2021-02-04,"Elizabeth C. Fine, Jennifer A. MacKinnon, Matthew H. Alford, John B. Mickett",Microstructure Observations of Turbulent Heat Fluxes in a Warm-Core Canada Basin Eddy,American Meteorological Society,Journal of Physical Oceanography,48,2397-2418,2018,
10.18739/A20K2699N,10.1130/G33365.1,https://doi.org/10.1130/G33365.1,2021-02-04,"W. J. D'Andrea, D. A. Vaillencourt, N. L. Balascio, A. Werner, S. R. Roof, M. Retelle, R. S. Bradley",Mild Little Ice Age and unprecedented recent warmth in an 1800 year lake sediment record from Svalbard,Geological Society of America,Geology,40,1007-1010,2012,
urn:uuid:281ee5ec-11cd-47ce-a166-d4d7951112bc,10.1029/2000JC000445,https://doi.org/10.1029/2000JC000445,2021-02-04,R. W. Lindsay,Ice deformation near SHEBA,American Geophysical Union (AGU),Journal of Geophysical Research,107,NULL,2002,
10.18739/A2736M17X,10.1144/SP344.9,https://doi.org/10.1144/SP344.9,2021-02-04,"Luke D. Trusel, R. D. Powell, R. M. Cumpston, J. Brigham-Grette","Modern glacimarine processes and potential future behaviour of Kronebreen and Kongsvegen polythermal tidewater glaciers, Kongsfjorden, Svalbard",Geological Society of London,"Geological Society, London, Special Publications",344,89-102,2010,
10.18739/A2WS8HK4Z,10.1144/SP344.9,https://doi.org/10.1144/SP344.9,2021-02-04,"Luke D. Trusel, R. D. Powell, R. M. Cumpston, J. Brigham-Grette","Modern glacimarine processes and potential future behaviour of Kronebreen and Kongsvegen polythermal tidewater glaciers, Kongsfjorden, Svalbard",Geological Society of London,"Geological Society, London, Special Publications",344,89-102,2010,
10.18739/A2CZ54,10.1002/2013JF002845,https://doi.org/10.1002/2013JF002845,2021-02-04,"Katherine R. Barnhart, Robert S. Anderson, Irina Overeem, Cameron Wobus, Gary D. Clow, Frank E. Urban",Modeling erosion of ice-rich permafrost bluffs along the Alaskan Beaufort Sea coast,American Geophysical Union (AGU),Journal of Geophysical Research: Earth Surface,119,1155-1179,2014,
10.18739/A22804Z93,10.1002/2013JF002845,https://doi.org/10.1002/2013JF002845,2021-02-04,"Katherine R. Barnhart, Robert S. Anderson, Irina Overeem, Cameron Wobus, Gary D. Clow, Frank E. Urban",Modeling erosion of ice-rich permafrost bluffs along the Alaskan Beaufort Sea coast,American Geophysical Union (AGU),Journal of Geophysical Research: Earth Surface,119,1155-1179,2014,
urn:uuid:3a4acc5d-8661-42f2-9003-2e36ff72123e,10.1002/2017WR021868,https://doi.org/10.1002/2017WR021868,2021-02-04,"Tyler V. King, Bethany T. Neilson, Mitchell T. Rasmussen",Estimating Discharge in Low‐Order Rivers With High‐Resolution Aerial Imagery,American Geophysical Union (AGU),Water Resources Research,54,863-878,2018,
urn:uuid:3a4acc5d-8661-42f2-9003-2e36ff72123e,10.1029/2018GL078140,https://doi.org/10.1029/2018GL078140,2021-02-04,"Bethany T. Neilson, M. Bayani Cardenas, Michael T. O'Connor, Mitchell T. Rasmussen, Tyler V. King, George W. Kling",Groundwater Flow and Exchange Across the Land Surface Explain Carbon Export Patterns in Continuous Permafrost Watersheds,American Geophysical Union (AGU),Geophysical Research Letters,45,7596-7605,2018,
urn:uuid:3a4acc5d-8661-42f2-9003-2e36ff72123e,10.5194/bg-12-6669-2015,https://doi.org/10.5194/bg-12-6669-2015,2021-02-04,"R. M. Cory, K. H. Harrold, B.T. Neilson, G. W. Kling",Controls on dissolved organic matter (DOM) degradation in a headwater stream: the influence of photochemical and hydrological conditions in determining light-limitation or substrate-limitation of photo-degradation,Copernicus GmbH,Biogeosciences,12,6669-6685,2015,
10.18739/A22J6846K,10.1175/JPO-D-17-0181.1,https://doi.org/10.1175/JPO-D-17-0181.1,2021-02-04,"P. Washam, A. Münchow, K. W. Nicholls","A Decade of Ocean Changes Impacting the Ice Shelf of Petermann Gletscher, Greenland",American Meteorological Society,Journal of Physical Oceanography,48,2477-2493,2018,
10.18739/A2XS5JH16,10.1175/JPO-D-16-0161.1,https://doi.org/10.1175/JPO-D-16-0161.1,2021-02-04,"Céline Heuzé, Anna Wåhlin, Helen L. Johnson, Andreas Münchow","Pathways of Meltwater Export from Petermann Glacier, Greenland",American Meteorological Society,Journal of Physical Oceanography,47,405-418,2016,
10.18739/A2DV1CP1W,10.1002/2015GL066296,https://doi.org/10.1002/2015GL066296,2021-02-04,"Stephanie A. Ewing, Jonathan A. O'Donnell, George R. Aiken, Kenna Butler, David Butman, Lisamarie Windham‐Myers, Mikhail Z. Kanevskiy","Long‐term anoxia and release of ancient, labile carbon upon thaw of Pleistocene permafrost",American Geophysical Union (AGU),Geophysical Research Letters,42,NULL,2015,
10.18739/A2DV1CP1W,10.1029/2006JF000531,https://doi.org/10.1029/2006JF000531,2021-02-04,"M. Torre Jorgenson, Yuri Shur",Evolution of lakes and basins in northern Alaska and discussion of the thaw lake cycle,American Geophysical Union (AGU),Journal of Geophysical Research,112,NULL,2007,
10.18739/A2DV1CP1W,10.1029/2005GL024960,https://doi.org/10.1029/2005GL024960,2021-02-04,"M. Torre Jorgenson, Yuri L. Shur, Erik R. Pullman",Abrupt increase in permafrost degradation in Arctic Alaska,American Geophysical Union (AGU),Geophysical Research Letters,33,NULL,2006,
10.18739/A2DV1CP1W,10.1088/1748-9326/8/3/035017,https://doi.org/10.1088/1748-9326/8/3/035017,2021-02-04,"M Torre Jorgenson, Jennifer Harden, Mikhail Kanevskiy, Jonathan O’Donnell, Kim Wickland, Stephanie Ewing, Kristen Manies, Qianlai Zhuang, Yuri Shur, Robert Striegl, Josh Koch","Reorganization of vegetation, hydrology and soil carbon after permafrost degradation across heterogeneous boreal landscapes",IOP Publishing,Environmental Research Letters,8,035017,2013,
10.18739/A2DV1CP1W,10.1139/X10-060,https://doi.org/10.1139/X10-060,2021-02-04,"M. Torre Jorgenson, Vladimir Romanovsky, Jennifer Harden, Yuri Shur, Jonathan O’Donnell, Edward A. G. Schuur, Mikhail Kanevskiy, Sergei Marchenko",Resilience and vulnerability of permafrost to climate changeThis article is one of a selection of papers from The Dynamics of Change in Alaska’s Boreal Forests: Resilience and Vulnerability in Response to Climate Warming.,Canadian Science Publishing,Canadian Journal of Forest Research,40,1219-1236,2010,
10.18739/A2DV1CP1W,10.1002/2015JF003602,https://doi.org/10.1002/2015JF003602,2021-02-04,"M. T. Jorgenson, M. Kanevskiy, Y. Shur, N. Moskalenko, D. R. N. Brown, K. Wickland, R. Striegl, J. Koch",Role of ground ice dynamics and ecological feedbacks in recent ice wedge degradation and stabilization,American Geophysical Union (AGU),Journal of Geophysical Research: Earth Surface,120,2280-2297,2015,
10.18739/A2DV1CP1W,10.1029/2010JG001588,https://doi.org/10.1029/2010JG001588,2021-02-04,"Chien-Lu Ping, Gary J. Michaelson, Laodong Guo, M. Torre Jorgenson, Mikhail Kanevskiy, Yuri Shur, Fugen Dou, Jingjing Liang",Soil carbon and material fluxes across the eroding Alaska Beaufort Sea coastline,American Geophysical Union (AGU),Journal of Geophysical Research,116,NULL,2011,
